{
  "$schema": "https://json-schema.org/draft/2020-12/schema",
  "$id": "https://tts-research.local/schemas/audio-artifact.v1.schema.json",
  "title": "AudioArtifact v1",
  "type": "object",
  "additionalProperties": false,
  "required": [
    "schemaVersion",
    "artifactId",
    "sourceId",
    "sourceRevisionId",
    "extractionRevisionId",
    "readalongManifestId",
    "segmentIds",
    "state",
    "generatedAt",
    "provider",
    "format",
    "compatibilityKey",
    "retry"
  ],
  "properties": {
    "schemaVersion": {
      "const": "audio-artifact.v1"
    },
    "artifactId": {
      "type": "string",
      "minLength": 1
    },
    "sourceId": {
      "type": "string",
      "minLength": 1
    },
    "sourceRevisionId": {
      "type": "string",
      "minLength": 1
    },
    "extractionRevisionId": {
      "type": "string",
      "minLength": 1
    },
    "readalongManifestId": {
      "type": "string",
      "minLength": 1
    },
    "segmentIds": {
      "type": "array",
      "items": {
        "type": "string",
        "minLength": 1
      },
      "default": []
    },
    "state": {
      "enum": [
        "generating",
        "unchecked",
        "checked",
        "stale",
        "replaced",
        "failed",
        "retryable",
        "interrupted_retriable"
      ]
    },
    "generatedAt": {
      "type": "string",
      "format": "date-time"
    },
    "checkedAt": {
      "type": "string",
      "format": "date-time"
    },
    "provider": {
      "type": "object",
      "additionalProperties": false,
      "required": ["name"],
      "properties": {
        "name": {
          "type": "string",
          "minLength": 1
        },
        "voiceId": {
          "type": "string",
          "minLength": 1
        },
        "model": {
          "type": "string",
          "minLength": 1
        }
      }
    },
    "format": {
      "enum": ["mp3", "wav", "ogg", "aac"]
    },
    "durationMs": {
      "type": "integer",
      "minimum": 0
    },
    "uri": {
      "type": "string"
    },
    "checksum": {
      "type": "string"
    },
    "compatibilityKey": {
      "type": "string",
      "minLength": 1
    },
    "replacementOfArtifactId": {
      "type": "string",
      "minLength": 1
    },
    "replacedByArtifactId": {
      "type": "string",
      "minLength": 1
    },
    "failureCode": {
      "type": "string"
    },
    "failureMessage": {
      "type": "string"
    },
    "retry": {
      "type": "object",
      "additionalProperties": false,
      "required": ["retryable", "scope"],
      "properties": {
        "retryable": {
          "type": "boolean"
        },
        "scope": {
          "enum": ["none", "artifact", "segment"]
        },
        "reason": {
          "type": "string"
        },
        "attempt": {
          "type": "integer",
          "minimum": 0
        },
        "nextAttemptAfter": {
          "type": "string",
          "format": "date-time"
        }
      }
    },
    "metadata": {
      "type": "object",
      "additionalProperties": true
    }
  }
}
