{
  "schemaVersion": "audio-artifact.v1",
  "artifactId": "audio-md-checked",
  "sourceId": "contract-markdown",
  "sourceRevisionId": "sr-md-002",
  "extractionRevisionId": "er-md-002",
  "readalongManifestId": "ram-md-002",
  "segmentIds": ["seg-0001"],
  "state": "checked",
  "generatedAt": "2026-05-17T01:13:00Z",
  "checkedAt": "2026-05-17T01:13:30Z",
  "provider": {
    "name": "fixture-tts",
    "voiceId": "voice-contract",
    "model": "fixture-v1"
  },
  "format": "mp3",
  "durationMs": 1700,
  "uri": "file://audio/audio-md-checked.mp3",
  "checksum": "sha256:audio-md-checked",
  "compatibilityKey": "ck-md-002-seg-0001",
  "retry": {
    "retryable": false,
    "scope": "none",
    "attempt": 0
  }
}
